Index,Title,Abstract,Year,PDF Link,Authors,Source,Predict
20,Status of Empirical Research in Software Engineering,"We provide an assessment of the status of empirical software research by analyzing all refereed articles that appeared in the Journal of Empirical Software Engineering from its first issue in January 1996 through June 2006. The journal publishes empirical software research exclusively and it is the only journal to do so. The main findings are: 1. The dominant empirical methods are experiments and case studies. Other methods (correlational studies, meta analysis, surveys, descriptive approaches, ex post facto studies) occur infrequently; long-term studies are missing. About a quarter of the experiments are replications. 2. Professionals are used somewhat more frequently than students as subjects. 3. The dominant topics studied are measurement/metrics and tools/methods/frameworks. Metrics research is dominated by correlational and case studies without any experiments. 4. Important topics are underrepresented or absent, for example: programming languages, model driven development, formal methods, and others. The narrow focus on a few empirically researched topics is in contrast to the broad scope of software research. ",2013,http://ieeexplore.ieee.org/stamp/stamp.jsp?arnumber=6618469,Andreas H?fer and Walter F. Tichy,"Book Series Lecture Notes in Computer Science, Volume 4336/2007, Book Empirical Software Engineering Issues. Critical Assessment and Future Directions, Pages 10-19, SpringerLink Date Monday, June 11, 2007",1
21,Systematic review of organizational motivations for adopting CMM-based SPI,"Background: Software Process Improvement (SPI) is intended to improve software engineering, but can only be effective if used. To improve SPI's uptake, we should understand why organizations adopt SPI. CMM-based SPI approaches are widely known and studied. Objective: We investigated why organizations adopt CMM-based SPI approaches, and how these motivations relate to organizations' size. Method: We performed a systematic review, examining reasons reported in more than forty primary studies. Results: Reasons usually related to product quality and project performance, and less commonly, to process. Organizations reported customer reasons infrequently and employee reasons very rarely. We could not show that reasons related to size. Conclusion: Despite its origins in helping to address customer-related issues for the USAF, CMM-based SPI has mostly been adopted to help organizations improve project performance and product quality issues. This reinforces a view that the goal of SPI is not to improve process per se, but instead to provide business benefits.",2008,http://dl.acm.org/citation.cfm?id=1365278&CFID=932221225&CFTOKEN=61415952,M. Staples and M. Niazi.,"Information and Software Technology 50 (7-8):605-620, 2008.",1
22,Systematic review: A systematic review of effect size in software engineering experiments,"An effect size quantifies the effects of an experimental treatment. Conclusions drawn from hypothesis testing results might be erroneous if effect sizes are not judged in addition to statistical significance. This paper reports a systematic review of 92 controlled experiments published in 12 major software engineering journals and conference proceedings in the decade 1993-2002. The review investigates the practice of effect size reporting, summarizes standardized effect sizes detected in the experiments, discusses the results and gives advice for improvements. Standardized and/or unstandardized effect sizes were reported in 29% of the experiments. Interpretations of the effect sizes in terms of practical importance were not discussed beyond references to standard conventions. The standardized effect sizes computed from the reviewed experiments were equal to observations in psychology studies and slightly larger than standard conventions in behavioral science. ",2007,http://ieeexplore.ieee.org/stamp/stamp.jsp?arnumber=4052585,"Vigdis By Kampenes, Tore Dyb?, Jo E. Hannay, Dag I. K. Sj?berg","Information and Software Technology,   Volume 49 Issue 11-12, November 2007, Publisher: Butterworth-Heinemann pp. 1073 - 1086",1
23,Tailoring and Introduction of the Rational Unified Process,RUP is a comprehensive software development process framework that has gained a lot of interest by the industry. One major challenge of taking RUP into use is to tailor it to specific needs and then to introduce it into a development organization. This study presents a review and a systematic assembly of existing studies on the tailoring and introduction of RUP. From a systematic search for study reports on this topic we found that most research is anecdotal and focus on the effects of RUP itself. Only a few number of studies address tailoring and introduction. We have found that tailoring RUP is a considerable challenge by itself and that it must be closely related to existing best practices. We see a tendency of turning from large complete process frameworks towards smaller and more light-weight processes which may impose a smoother transition from process model to process in use. ,2009,http://ieeexplore.ieee.org/stamp/stamp.jsp?arnumber=5362562,"Geir Kjetil Hanssen, Finn Olav Bj?rnson and Hans Westerheim","Book Series Lecture Notes in Computer Science, Publisher Springer Berlin / Heidelberg, Volume 4764/2007, Book Software Process Improvement, Pages 7-18, SpringerLink Date Thursday, September 13, 2007",1
24,Techniques for developing more accessible web applications: a survey towards a process classification,"<p>The Web has become one of the most important communication media, since it is spread all over the world. In order to enable everyone to access this medium, Web accessibility has become an emerging topic, and many techniques have been evolved to support the development of accessible Web content. This paper presents a survey on techniques for Web accessibility and proposes a classification into the processes of ISO/IEC 12207 standard. The survey was carried out applying systematic review principles during the literature review. The results include analysis obtained from the synthesis of 53 studies, selected from an initial set of 844. Although the survey results indicate a growth in research on techniques for design and evaluation of Web applications, they also indicate that several development activities have been poorly addressed by scientific research efforts.</p>",2007,http://dl.acm.org/citation.cfm?id=1297177&CFID=932218671&CFTOKEN=40893134,"Andre Pimenta Freire, Rudinei Goularte, Renata Pontin de Mattos Fortes","SIGDOC '07: Proceedings of the 25th annual ACM international conference on Design of communication , October 2007  , Publisher: ACM",1
25,The Role of Deliberate Artificial Design Elements in Software Engineering Experiments,"Increased realism in software engineering experiments is often promoted as an important means of increasing generalizability and industrial relevance. In this context, artificiality, e.g., the use of constructed tasks in place of realistic tasks, is seen as a threat. In this paper, we examine the opposite view that deliberately introduced artificial design elements may increase knowledge gain and enhance both generalizability and relevance. In the first part of this paper, we identify and evaluate arguments and examples in favor of and against deliberately introducing artificiality into software engineering experiments. We find that there are good arguments in favor of deliberately introducing artificial design elements to 1) isolate basic mechanisms, 2) establish the existence of phenomena, 3) enable generalization from particularly unfavorable to more favorable conditions (persistence of phenomena), and 4) relate experiments to theory. In the second part of this paper, we summarize a content analysis of articles that report software engineering experiments published over a 10-year period from 1993 to 2002. The analysis reveals a striving for realism and external validity, but little awareness of for what and when various degrees of artificiality and realism are appropriate. Furthermore, much of the focus on realism seems to be based on a narrow understanding of the nature of generalization. We conclude that an increased awareness and deliberation as to when and for what purposes both artificial and realistic design elements are applied is valuable for better knowledge gain and quality in empirical software engineering experiments. We also conclude that time spent on studies that have obvious threats to validity that are due to artificiality might be better spent on studies that investigate research questions for which artificiality is a strength rather than a weakness. However, arguments in favor of artificial design elements should not be used to justify studies - - that are badly designed or that have research questions of low relevance.",2008,http://ieeexplore.ieee.org/stamp/stamp.jsp?arnumber=4453833,"By Jo Hannay , Magne J?rgensen","Found in: IEEE Transactions on Software Engineering 
Issue Date:March 2008 , pp. 242-259",1
26,The type of evidence produced by empirical software engineers,"This paper reports on the research published between the years 1997 and 2003 inclusive in the journal of Empirical Software Engineering, drawing on the taxonomy developed by Glass et al. in [3]. We found that the research was somewhat narrow in topic with about half the papers focusing on measurement/metrics, review and inspection; that researchers were almost as interested in formulating as in evaluating; that hypothesis testing and laboratory experiments dominated evaluations; that research was not very likely to focus on people and extremely unlikely to refer to other disciplines. We discuss our findings in the context of making empirical software engineering more relevant to practitioners.",2005,http://dl.acm.org/citation.cfm?id=1083176&CFID=932225534&CFTOKEN=50437810,"Judith Segal, Antony Grinyer, Helen Sharp","REBSE '05: Proceedings of the 2005 workshop on Realising evidence-based software engineering, May 2005, Publisher: ACM, pp. 66-73",1
28,Cross versus Within-Company Cost Estimation Studies: A Systematic Review,"The objective of this paper is to determine under what circumstances individual organizations would be able to rely on cross-company-based estimation models. We performed a systematic review of studies that compared predictions from cross-company models with predictions from within-company models based on analysis of project data. Ten papers compared cross-company and within-company estimation models; however, only seven presented independent results. Of those seven, three found that cross-company models were not significantly different from within-company models, and four found that cross-company models were significantly worse than within-company models. Experimental procedures used by the studies differed making it impossible to undertake formal meta-analysis of the results. The main trend distinguishing study results was that studies with small within-company data sets (i.e., $20 projects) that used leave-one-out cross validation all found that the within-company model was significantly different (better) from the cross-company model. The results of this review are inconclusive. It is clear that some organizations would be ill-served by cross-company models whereas others would benefit. Further studies are needed, but they must be independent (i.e., based on different data bases or at least different single company data sets) and should address specific hypotheses concerning the conditions that would favor cross-company or within-company models. In addition, experimenters need to standardize their experimental procedures to enable formal meta-analysis, and recommendations are made in Section 3.",2007,http://ieeexplore.ieee.org/abstract/document/4160970/,"By Barbara A. Kitchenham , Emilia Mendes , Guilherme H. Travassos","Found in: IEEE Transactions on Software Engineering ,Issue Date:May 2007 
pp. 316-329",1
29,A Systematic Review of Software Development Cost Estimation Studies,"This paper aims to provide a basis for the improvement of software-estimation research through a systematic review of previous work. The review identifies 304 software cost estimation papers in 76 journals and classifies the papers according to research topic, estimation approach, research approach, study context and data set. A Web-based library of these cost estimation papers is provided to ease the identification of relevant estimation research results. The review results combined with other knowledge provide support for recommendations for future software cost estimation research, including: 1) increase the breadth of the search for relevant studies, 2) search manually for relevant papers within a carefully selected set of journals when completeness is essential, 3) conduct more studies on estimation methods commonly used by the software industry, and 4) increase the awareness of how properties of the data sets impact the results when evaluating estimation methods",2007,http://ieeexplore.ieee.org/abstract/document/4027147/,"By Magne Jorgensen , Martin Shepperd","Found in: IEEE Transactions on Software Engineering ,Issue Date:January 2007 
pp. 33-53",1
30,A Survey of Controlled Experiments in Software Engineering,"The classical method for identifying cause-effect relationships is to conduct controlled experiments. This paper reports upon the present state of how controlled experiments in software engineering are conducted and the extent to which relevant information is reported. Among the 5,453 scientific articles published in 12 leading software engineering journals and conferences in the decade from 1993 to 2002, 103 articles (1.9 percent) reported controlled experiments in which individuals or teams performed one or more software engineering tasks. This survey quantitatively characterizes the topics of the experiments and their subjects (number of subjects, students versus professionals, recruitment, and rewards for participation), tasks (type of task, duration, and type and size of application) and environments (location, development tools). Furthermore, the survey reports on how internal and external validity is addressed and the extent to which experiments are replicated. The gathered data reflects the relevance of software engineering experiments to industrial practice and the scientific maturity of software engineering research.",2005,http://ieeexplore.ieee.org/abstract/document/1514443/,"By Dag I.K. Sjoberg , Jo E. Hannay , Ove Hansen , Vigdis By Kampenes , Amela Karahasanovic , Nils-Kristian Liborg , Anette C. Rekdal","Found in: IEEE Transactions on Software Engineering
Issue Date:September 2005 , pp. 733-753",1
31,A Survey on Software Estimation in the Norwegian Industry,"Abstract:
We provide an overview of the estimation methods that software companies apply to estimate their projects, why those methods are chosen, and how accurate they are. In order to improve estimation accuracy, such knowledge is essential. We conducted an in-depth survey, where information was collected through structured interviews with senior managers from 18 different companies and project managers of 52 different projects. We analyzed information about estimation approach, effort estimation accuracy and bias, schedule estimation accuracy and bias, delivered functionality and other estimation related information. Our results suggest, for example, that average effort overruns are 41%, that the estimation performance has not changed much the last 10-20 years, that expert estimation is the dominating estimation method, that estimation accuracy is not much impacted by use of formal estimation models, and that software managers tend to believe that the estimation accuracy of their company is better than it actually is.",2004,http://ieeexplore.ieee.org/abstract/document/1357904/,"By Kjetil Molokken-Ostvold , Magne Jorgensen , Sinan S. Tanilkan , Hans Gallis , Anette C. Lien , Siw E. Hove","Found in: 10th IEEE International Symposium on Software Metrics (METRICS'04) 
Issue Date:September 2004 , pp. 208-219",1
32,A Systematic Review of Theory Use in Software Engineering Experiments,"Empirically based theories are generally perceived as foundational to science. However, in many disciplines, the nature, role and even the necessity of theories remain matters for debate, particularly in young or practical disciplines such as software engineering. This article reports a systematic review of the explicit use of theory in a comprehensive set of 103 articles reporting experiments, from of a total of 5,453 articles published in major software engineering journals and conferences in the decade 1993-2002. Of the 103 articles, 24 use a total of 40 theories in various ways to explain the cause-effect relationship(s) under investigation. The majority of these use theory in the experimental design to justify research questions and hypotheses, some use theory to provide post hoc explanations of their results, and a few test or modify theory. A third of the theories are proposed by authors of the reviewed articles. The interdisciplinary nature of the theories used is greater than that of research in software engineering in general. We found that theory use and awareness of theoretical issues are present, but that theory-driven research is, as yet, not a major issue in empirical software engineering. Several articles comment explicitly on the lack of relevant theory. We call for an increased awareness of the potential benefits of involving theory, when feasible. To support software engineering researchers who wish to use theory, we show which of the reviewed articles on which topics use which theories for what purposes, as well as details of the theories' characteristics",2007,http://ieeexplore.ieee.org/abstract/document/4052585/,"By Jo E. Hannay , Dag I.K. Sjoberg , Tore Dyba","Found in: IEEE Transactions on Software Engineering
Issue Date:February 2007 , pp. 87-107",1
33,A systematic review of Web engineering research,"Abstract:
This paper uses a systematic literature review as means of investigating the rigor of claims arising from Web engineering research. Rigor is measured using criteria combined from software engineering research. We reviewed 173 papers and results have shown that only 5% would be considered rigorous methodologically. In addition to presenting our results, we also provide suggestions for improvement of Web engineering research based on lessons learnt by the software engineering community.",2005,http://ieeexplore.ieee.org/abstract/document/1541857/,By E. Mendes,"Found in: 2005 International Symposium on Empirical Software Engineering, 2005. 
Issue Date:November 2005 , pp. 10 pp.",1
34,Are Two Heads Better than One? On the Effectiveness of Pair Programming,"Pair programming is a collaborative approach that makes working in pairs rather than individually the primary work style for code development. Because PP is a radically different approach than many developers are used to, it can be hard to predict the effects when a team switches to PP. Because projects focus on different things, this article concentrates on understanding general aspects related to effectiveness, specifically project duration, effort, and quality. Not unexpectedly, our meta-analysis showed that the question of whether two heads are better than one isn't precise enough to be meaningful. Given the evidence, the best answer is ""it depends"" - on both the programmer's expertise and the complexity of the system and tasks to be solved. Two heads are better than one for achieving correctness on highly complex programming tasks. They might also have a time gain on simpler tasks. Additional studies would be useful. For example, further investigation is clearly needed into the interaction of complexity and programmer experience and how they affect the appropriateness of a PP approach; our current understanding of this phenomenon rests chiefly on a single (although large) study. Only by understanding what makes pairs work and what makes them less efficient can we take steps to provide beneficial work conditions, to avoid detrimental conditions, and to avoid pairing altogether when conditions are detrimental. With the right cooks and the right combination of ingredients, the broth has the potential to be very good indeed.",2007,http://ieeexplore.ieee.org/stamp/stamp.jsp?arnumber=4375233,"By Tore Dyb? , Erik Arisholm , Dag I.K. Sj?berg , Jo E. Hannay , Forrest Shull","Found in: IEEE Software 
Issue Date:November 2007 , pp. 12-15",1
35,Do SQA Programs Work - CMM Works. A Meta Analysis,"Many software development professionals and managers of software development organizations are not fully convinced in the profitability of investments for the advancement of SQA systems. The results included in each of the articles we found, cannot lead to general conclusions on the impact of investments in upgrading an SQA system. Our meta analysis was based on CMM level transition (CMMLT) analysis of available publications and was for the seven most common performance metric. The CMMLT analysis is applicable for combined analysis of empirical data from many sources. Each record in our meta analysis database is calculated as ""after-before ratio"", which is nearly free of the studied organization's characteristics. Because the CMM guidelines and SQA requirement are similar, we claim that the results for CMM programs are also applicable to investments in SQA systems. The extensive database of over 1,800 projects from a variety of 19 information sources leading to the meta analysis results - proved that investments in CMM programs and similarly in SQA systems contribute to software development performance.",2005,http://ieeexplore.ieee.org/stamp/stamp.jsp?arnumber=1421069,"By Daniel Galin , Moti Avrahami","Found in: IEEE International Conference on Software - Science, Technology & Engineering (SwSTE'05) 
Issue Date:February 2005 
pp. 95-100",1
36,Are CMM Program Investments Beneficial? Analyzing Past Studies,"CMM experts strongly believe that investments in programs promoting an organization's CMM maturity yield substantial organizational and economic benefits. In particular, they argue that CMM programs that implement software process improvements can provide more benefits",2006,http://ieeexplore.ieee.org/stamp/stamp.jsp?arnumber=4012629,"By Daniel Galin , Motti Avrahami","Found in: IEEE Software 
Issue Date:November 2006 
pp. 81-87",1
37,"Capture-recapture in software inspections after 10 years research - theory, evaluation and application.","Software inspection is a method to detect faults in the early phases of the software life cycle. In order to estimate the number of faults?not?found, capture?recapture was introduced for software inspections in 1992 to estimate remaining faults after an inspection. Since then, several papers have been written in the area, concerning the basic theory, evaluation of models and application of the method. This paper summarizes the work made in capture?recapture for software inspections during these years. Furthermore, and more importantly, the contribution of the papers are classified as?theory,?evaluation?or?application, in order to analyse the performed research as well as to highlight the areas of research that need further work. It is concluded that (1) most of the basic theory is investigated within biostatistics, (2) most software engineering research is performed on evaluation, a majority ending up in recommendation of the Mh?JK model, and (3) there is a need for application experiences. In order to support the application, an inspection process is presented with decision points based on capture?recapture estimates.",2004,http://www.sciencedirect.com/science/article/pii/S0164121203000906,"H. Petersson, T. Thelin, P. Runeson, and C. Wohlin.","Journal of Systems and Software 72 (2):249-264, 2004.",1
38,A systematic review of statistical power in software engineering experiments.,"Statistical power is an inherent part of empirical studies that employ significance testing and is essential for the planning of studies, for the interpretation of study results, and for the validity of study conclusions. This paper reports a quantitative assessment of the statistical power of empirical software engineering research based on the 103 papers on controlled experiments (of a total of 5,453 papers) published in nine major software engineering journals and three conference proceedings in the decade 19932002. The results show that the statistical power of software engineering experiments falls substantially below accepted norms as well as the levels found in the related discipline of information systems research. Given this study's findings, additional attention must be directed to the adequacy of sample sizes and research designs to ensure acceptable levels of statistical power. Furthermore, the current reporting of significance tests should be enhanced by also reporting effect sizes and confidence intervals.",2007,http://ieeexplore.ieee.org/stamp/stamp.jsp?arnumber=4052585,"T. Dyba, V. B. Kampenes, and D. I. K. Sjoberg.","Information and Software Technology 48 (8):745-755, 2006.",1
