Index,Title,Abstract,Year,PDF Link,Authors,Source,Predict
39,Software effort estimation terminology: The tower of Babel.,"It is well documented that the software industry suffers from frequent cost overruns. A contributing factor is, we believe, the imprecise estimation terminology in use. A lack of clarity and precision in the use of estimation terms reduces the interpretability of estimation accuracy results, makes the communication of estimates difficult, and lowers the learning possibilities. This paper reports on a structured review of typical software effort estimation terminology in software engineering textbooks and software estimation research papers. The review provides evidence that the term ?effort estimate? is frequently used without sufficient clarification of its meaning, and that estimation accuracy is often evaluated without ensuring that the estimated and the actual effort are comparable. Guidelines are suggested on how to reduce this lack of clarity and precision in terminology.",2006,http://www.sciencedirect.com/science/article/pii/S0950584905000674,"S. Grimstad, M. Jorgensen, and K. Molokken-Ostvold.","Information and Software Technology 48 (4):302-310, 2006.",1
40,In Search of What We Experimentally Know about Unit Testing,"Gathering evidence in any discipline is a lengthy procedure, requiring experimentation and empirical confirmation to transform information from mere opinion to undisputed fact. Software engineering is a relatively young field and experimental SE is even younger, so undisputed facts are few and far between. Nevertheless, ESE's relevance is growing because experimental results can help practitioners make better decisions. We have aggregated results from unit-testing experiments with the aim of identifying information with some experimental basis that might help practitioners make decisions. Most of the experiments focus on two important characteristics of testing techniques: effectiveness and efficiency. Some other experiments study the quality of test-case sets according to different criteria",2006,http://ieeexplore.ieee.org/stamp/stamp.jsp?arnumber=4012628,"By Natalia Juristo , Ana M. Moreno , Sira Vegas , Martin Solari","Found in: IEEE Software 
Issue Date:November 2006 
pp. 72-80",1
41,Precise Identification of Side-Effect-Free Methods in Java,"Knowing which methods do not have side effects is necessary in a variety of software tools for program understanding, restructuring, optimization, and verification. We present a general approach for identifying side-effect-free methods in Java software. Our technique is parameterized by class analysis and is designed to work on incomplete programs. We present empirical results from two instantiations of the approach, based on rapid type analysis and on points-to analysis. In our experiments with several components, on average 22% of the investigated methods were identified as free of side effects. We also present a precision evaluation which shows that the approach achieves almost perfect precision - i.e., it almost never misses methods that in reality have no side effects. These results indicate that very precise identification of side-effect-free methods is possible with simple and inexpensive analysis techniques, and therefore can be easily incorporated in software tools.",2004,http://ieeexplore.ieee.org/stamp/stamp.jsp?arnumber=1357793,By Atanas Rountev,"Found in: 20th IEEE International Conference on Software Maintenance (ICSM'04) 
Issue Date:September 2004 
pp. 82-91",1
42,Reviewing 25 Years of Testing Technique Experiments,"Mature knowledge allows engineering disciplines the achievement of predictable results. Unfortunately, the type of knowledge used in software engineering can be considered to be of a relatively low maturity, and developers are guided by intuition, fashion or market-speak rather than by facts or undisputed statements proper to an engineering discipline. Testing techniques determine different criteria for selecting the test cases that will be used as input to the system under examination, which means that an effective and efficient selection of test cases conditions the success of the tests. The knowledge for selecting testing techniques should come from studies that empirically justify the benefits and application conditions of the different techniques. This paper analyzes the maturity level of the knowledge about testing techniques by examining existing empirical studies about these techniques. We have analyzed their results, and obtained a testing technique knowledge classification based on their factuality and objectivity, according to four parameters.",2004,https://link.springer.com/article/10.1023%2FB%3AEMSE.0000013513.48963.1b?LI=true,"Natalia Juristo, Ana M. Moreno, Sira Vegas","March 2004 
Empirical Software Engineering,   Volume 9 Issue 1-2 
Publisher: Kluwer Academic Publishers",1
43,What Do We Know about Defect Detection Methods?,"A survey of defect detection studies comparing inspection and testing techniques yields practical recommendations: use inspections for requirements and design defects, and use testing for code. Evidence-based software engineering can help software practitioners decide which methods to use and for what purpose. EBSE involves defining relevant questions, surveying and appraising avail able empirical evidence, and integrating and evaluating new practices in the target environment. This article helps define questions regarding defect detection techniques and presents a survey of empirical studies on testing and inspection techniques. We then interpret the findings in terms of practical use. The term defect always relates to one or more underlying faults in an artifact such as code. In the context of this article, defects map to single faults",2006,http://ieeexplore.ieee.org/stamp/stamp.jsp?arnumber=1628944,"By Per Runeson , Carina Andersson , Thomas Thelin , Anneliese Andrews , Tomas Berling","Found in: IEEE Software Issue Date:May 2006 
pp. 82-90",1
44,On the success of empirical studies in the international conference on software engineering,"Critiques of the quantity and quality of empirical evaluations in software engineering have existed for quite some time. However such critiques are typically not empirically evaluated. This paper fills this gap by empirically analyzing papers published by ICSE, the prime research conference on Software Engineering. We present quantitative and qualitative results of a quasi-random experiment of empirical evaluations over the lifetime of the conference. Our quantitative results show the quantity of empirical evaluation has increased over 29 ICSE proceedings but we still have room to improve the soundness of empirical evaluations in ICSE proceedings. Our qualitative results point to specific areas of improvement in empirical evaluations.",2006,http://dl.acm.org/citation.cfm?id=1134333,"Carmen Zannier, Grigori Melnik, Frank Maurer","ICSE '06: Proceedings of the 28th international conference on Software engineering, May 2006,  Publisher: ACM",1
