Index,Title,Abstract,Year,PDF Link,Authors,Source,Predict
0,A Conceptual Model of ICT-Supported Unified Process of International Outsourcing of Software Production,"This is an ongoing research in international outsourcing software production. This research examines how Software production through the ICTsupported unified process of international outsourcing could be executed and managed effectively. To address this research question, the results of an in-depth literature review in the areas of outsourcing, international outsourcing, information technology, and international software production is presented. This study proposes the information communication technologies' (ICT) - supported unified process model of international outsourcing of software production (SUPMIOSP). ICT-SUPMIOSP provides a detailed guideline on how to manage the entire process of international outsourcing by integrating a number of key issues such as relationship and risks management. Both theoretical and practical aspects of ICTSUPMIOSP are presented. At the theoretical level, the model can be used as a basis for further research, while at the practical level, it helps managers and other stakeholders to understand the multiple activities involved in offshore outsourcing, improve, systematize, and execute the ICT-SUPIOSP more effectively and efficiently.",2006,http://ieeexplore.ieee.org/stamp/stamp.jsp?arnumber=4031306,Anicet Yalaho,"EDOCW '06: Proceedings of the 10th IEEE on International Enterprise Distributed Object Computing Conference Workshops , October 2006, Publisher: IEEE Computer Society",1
1,A Quantitative Assessment of Requirements Engineering Publications ? 1963?2006,"<p>Requirements engineering research has been conducted for over 40 years. It is important to recognize the plethora of results accumulated to date to: (a) improve researchers' understanding of the historical roots of our field in the real-world and the problems that they are trying to solve, (b) expose researchers to the breadth and depth of solutions that have been proposed, (c) provide a synergistic basis for improving those solutions or building new ones to solve real-world problems facing the industry today, and d) increase practitioner awareness of available solutions. A detailed meta-analysis of the requirements engineering literature will provide an objective overview of the advances and current state of the discipline. This paper represents the first step in a planned multi-year analysis. It presents the results of a demographic analysis by date, type, outlet, author, and author affiliation for an existing database of over 4,000 requirements engineering publications.</p>",2007,http://dl.acm.org/citation.cfm?id=1768914&CFID=932216837&CFTOKEN=18963453,"Alan Davis  , Ann Hickey  , Oscar Dieste  , Natalia Juristo   and Ana Moreno","Book Series Lecture Notes in Computer Science, Volume 4542/2007, Book Requirements Engineering: Foundation for Software Quality, Pages 129-143, SpringerLink Date Thursday, June 28, 2007",1
2,A survey and taxonomy of approaches for mining software repositories in the context of software evolution,"<p>A comprehensive literature survey on approaches for mining software repositories (MSR) in the context of software evolution is presented. In particular, this survey deals with those investigations that examine multiple versions of software artifacts or other temporal information. A taxonomy is derived from the analysis of this literature and presents the work via four dimensions: the type of software repositories mined (what), the purpose (why), the adopted/invented methodology used (how), and the evaluation method (quality). The taxonomy is demonstrated to be expressive (i.e., capable of representing a wide spectrum of MSR investigations) and effective (i.e., facilitates similarities and comparisons of MSR investigations). Lastly, a number of open research issues in MSR that require further investigation are identified.</p>",2007,http://dl.acm.org/citation.cfm?id=1345057&CFID=932209910&CFTOKEN=86972045,"Huzefa Kagdi, Michael L. Collard, Jonathan I. Maletic","Journal of Software Maintenance and Evolution: Research and Practice,   Volume 19 Issue 2, March 2007, Publisher: John Wiley & Sons, Inc.",1
3,An analysis of data sets used to train and validate cost prediction systems,"OBJECTIVE - to build up a picture of the nature and type of data sets being used to develop and evaluate different software project effort prediction systems. We believe this to be important since there is a growing body of published work that seeks to assess different prediction approaches.METHOD - we performed an exhaustive search from 1980 onwards from three software engineering journals for research papers that used project data sets to compare cost prediction systems.RESULTS - this identified a total of 50 papers that used, one or more times, a total of 71 unique project data sets. We observed that some of the better known and easily accessible data sets were used repeatedly making them potentially disproportionately influential. Such data sets also tend to be amongst the oldest with potential problems of obsolescence. We also note that only about 60% of all data sets are in the public domain. Finally, extracting relevant information from research papers has been time consuming due to different styles of presentation and levels of contextural information.CONCLUSIONS - first, the community needs to consider the quality and appropriateness of the data set being utilised; not all data sets are equal. Second, we need to assess the way results are presented in order to facilitate meta-analysis and whether a standard protocol would be appropriate.",2005,http://dl.acm.org/citation.cfm?id=1083166&CFID=932222344&CFTOKEN=20329875,"Carolyn Mair, Martin Shepperd, Magne J?rgensen","PROMISE '05: Proceedings of the 2005 workshop on Predictor models in software engineering, May 2005",1
4,Challenges in Collaborative Modeling: A Literature Review,"Modeling is a key activity in conceptual design and system design. Users as well as stakeholders, experts and entrepreneurs need to be able to create shared understanding about a system representation. In this paper we conducted a literature review to provide an overview of studies in which collaborative modeling efforts have been conducted to give first insights in the challenges of collaborative modeling, specifically with respect to group composition, collaboration & participation methods, modeling methods and quality in collaborative modeling. We found a critical challenge in dealing with the lack of modeling skills, such as having a modeler to support the group, or create the model for the group versus training to empower participants to actively participate in the modeling effort, and another critical challenge in resolving conflicting (parts of) models and integration of submodels or models from different perspectives. The overview of challenges presented in this paper will inspire the design of methods and support systems that will ultimately advance the efficiency and effectiveness of collaborative modeling tasks.",2014,http://ieeexplore.ieee.org/stamp/stamp.jsp?arnumber=6846871,"Michiel Renger, Gwendolyn L. Kolfschoten   and Gert-Jan de Vreede","Book Series Lecture Notes in Business Information Processing, Volume 10, Book Advances in Enterprise Engineering I, Pages 61-77, SpringerLink Date Tuesday, June 10, 2008",1
6,Data sets and data quality in software engineering,"OBJECTIVE - to assess the extent and types of techniques used to manage quality within software engineering data sets. We consider this a particularly interesting question in the context of initiatives to promote sharing and secondary analysis of data sets. METHOD - we perform a systematic review of available empirical software engineering studies. RESULTS - only 23 out of the many hundreds of studies assessed, explicitly considered data quality. CONCLUSIONS - first, the community needs to consider the quality and appropriateness of the data set being utilised; not all data sets are equal. Second, we need more research into means of identifying, and ideally repairing, noisy cases. Third, it should become routine to use sensitivity analysis to assess conclusion stability with respect to the assumptions that must be made concerning noise levels.",2005,http://ieeexplore.ieee.org/stamp/stamp.jsp?arnumber=1541819,"Gernot A. Liebchen, Martin Shepperd","PROMISE '08: Proceedings of the 4th international workshop on Predictor models in software engineering, May 2008 , Publisher: ACM",1
7,Developing Open Source Software: A Community-Based Analysis of Research,"Open source software (OSS) creates the potential for the inclusion of large and diverse communities in every aspect of the software development and consumption life cycle. However, despite 6 years of effort by an ever growing research community, we still dont know exactly what we do and dont know about OSS, nor do we have a clear idea about the basis for our knowledge. This paper presents an analysis of 155 research artefacts in the area of open source software. The purpose of the study is to identify the kinds of open source project communities that have been researched, the kinds of research questions that have been asked, and the methodologies used by researchers. Emerging from the study is a clearer understanding of what we do and dont know about open source software, and recommendations for future research efforts ",2015,http://ieeexplore.ieee.org/stamp/stamp.jsp?arnumber=7449480,"Joseph Feller, Patrick Finnegan, David Kelly and Maurice MacNamara","Book Series IFIP International Federation for Information Processing, Volume 208/2006, Book Social Inclusion: Societal and Organizational Implications for Information Systems, Pages 261-278, SpringerLink Date Wednesday, September 13, 2006",1
8,Effectiveness of Requirements Elicitation Techniques: Empirical Results Derived from a Systematic Review,"This paper reports a systematic review of empirical studies concerning the effectiveness of elicitation techniques, and the subsequent aggregation of empirical evidence gathered from those studies. The most significant results of the aggregation process are as follows: (I) interviews, preferentially structured, appear to be one of the most effective elicitation techniques; (2) many techniques often cited in the literature, like card sorting, ranking or thinking aloud, tend to be less effective than interviews; (3) analyst experience does not appear to be a relevant factor; and (4) the studies conducted have not found the use of intermediate representations during elicitation to have significant positive effects. It should be noted that, as a general rule, the studies from which these results were aggregated have not been replicated, and therefore the above claims cannot be said to be absolutely certain. However, they can be used by researchers as pieces of knowledge to be further investigated and by practitioners in development projects, always taking into account that they are preliminary findings",2006,http://ieeexplore.ieee.org/stamp/stamp.jsp?arnumber=1704061,"By Alan Davis , Oscar Dieste , Ann Hickey , Natalia Juristo , Ana M. Moreno","Found in: 14th IEEE International Requirements Engineering Conference (RE'06)
Issue Date:September 2006 , pp. 179-188",1
9,Evidence-Based Guidelines for Assessment of Software Development Cost Uncertainty,"Several studies suggest that uncertainty assessments of software development costs are strongly biased toward overconfidence, i.e., that software cost estimates typically are believed to be more accurate than they really are. This overconfidence may lead to poor project planning. As a means of improving cost uncertainty assessments, we provide evidence-based guidelines for how to assess software development cost uncertainty, based on results from relevant empirical studies. The general guidelines provided are: 1) Do not rely solely on unaided, intuition-based uncertainty assessment processes, 2) do not replace expert judgment with formal uncertainty assessment models, 3) apply structured and explicit judgment-based processes, 4) apply strategies based on an outside view of the project, 5) combine uncertainty assessments from different sources through group work, not through mechanical combination, 6) use motivational mechanisms with care and only if greater effort is likely to lead to improved assessments, and 7) frame the assessment problem to fit the structure of the relevant uncertainty information and the assessment process. These guidelines are preliminary and should be updated in response to new evidence.",2005,http://ieeexplore.ieee.org/stamp/stamp.jsp?arnumber=1556553,By Magne Jorgensen,"Found in: IEEE Transactions on Software Engineering 
Issue Date:November 2005 , pp. 942-954",1
10,Experimental context classification: incentives and experience of subjects,"There is a need to identify factors that affect the result of empirical studies in software engineering research. It is still the case that seemingly identical replications of controlled experiments result in different conclusions due to the fact that all factors describing the experiment context are not clearly defined and hence controlled. In this article, a scheme for describing the participants of controlled experiments is proposed and evaluated. It consists of two main factors, the incentives for participants in the experiment and the experience of the participants. The scheme has been evaluated by classifying a set of previously conducted experiments from literature. It can be concluded that the scheme was easy to use and understand. It is also found that experiments that are classified in the same way to a large extent point at the same results, which indicates that the scheme addresses relevant factors.",2005,http://ieeexplore.ieee.org/stamp/stamp.jsp?arnumber=1553590,"Martin H?st, Claes Wohlin, Thomas Thelin","ICSE '05: Proceedings of the 27th international conference on Software engineering, May 2005, Publisher: ACM",1
11,How Does a Measurement Programme Evolve in Software Organizations?,"<p><p>Establishing a software measurement programme within an organization is not a straightforward task. Previous literature surveys have focused on software process improvement in general and software measurement has been analysed in case studies. This literature survey collects the data from separate cases and presents the critical success factors that are specific to software measurement programmes. We present a categorization of the success factors based on organizational roles that are involved in measurement. Furthermore, the most essential elements of success in different phases of the life cycle of the measurement programme are analysed. It seems that the role of upper management is crucial when starting measurement and the individual developers' impact increases in the later phases. Utilization of the measurement data and improvement of the measurement and development processes requires active management support again.</p></p>",2008,http://dl.acm.org/citation.cfm?id=1425920&CFID=932207713&CFTOKEN=72281918,"Lasse Harjumaa, Jouni Markkula and Markku Oivo","Book Series Lecture Notes in Computer Science, Volume 5089/2008, Book Product-Focused Software Process Improvement, Pages 230-243, SpringerLink Date Tuesday, June 17, 2008",1
13,In search of `architectural knowledge',"The software architecture community puts more and more emphasis on 'architectural knowledge'. However, there appears to be no commonly accepted definition of what architectural knowledge entails, which makes it a fuzzy concept. In order to obtain a better understanding of how different authors view 'architectural knowledge', we have conducted a systematic review to examine how architectural knowledge is defined and how the different definitions in use are related. From this review it became clear that many authors do not provide a concrete definition of what they think architectural knowledge entails. What is more intriguing, though, is that those who do give a definition seem to agree that architectural knowledge spans from problem domain through decision making to solution; an agreement that is not obvious from the definitions themselves, but which is only brought to light after careful systematic comparison of the different studies.",2010,http://ieeexplore.ieee.org/stamp/stamp.jsp?arnumber=5659173,"Remco C. de Boer, Rik Farenhorst","SHARK '08: Proceedings of the 3rd international workshop on Sharing and reusing architectural knowledge, May 2008 , Publisher: ACM",1
14,Measurement in software engineering: From the roadmap to the crossroads.,"Research on software measurement can be organized around five key conceptual and methodological issues: how to apply measurement theory to software, how to frame software metrics, how to develop metrics, how to collect core measures, and how to analyze measures. The subject is of special concern for the industry, which is interested in improving practices - mainly in developing countries, where the software industry represents an opportunity for growth and usually receives institutional support for matching international quality standards. Academics are also in need of understanding and developing more effective methods for managing the software process and assessing the success of products and services, as a result of an enhanced awareness about the emergency of aligning business processes and information systems. This paper unveils the fundamentals of measurement in software engineering and discusses current issues and foreseeable trends for the subject. A literature review was performed within major academic publications in the last decade, and findings suggest a sensible shift of measurement interests towards managing the software process as a whole - without losing from sight the customary focus on hard issues like algorithm efficiency and worker productivity",1997,http://ieeexplore.ieee.org/stamp/stamp.jsp?arnumber=585509,"C. G. P. Bellini, R. D. D. Pereira, and J. L. Becker.","International Journal of Software Engineering and Knowledge Engineering 18 (1):37-64, 2008.",1
15,Mobile Systems Development: A Literature Review,"This article reviews 105 representative contributions to the literature on mobile systems development. The contributions are categorized according to a simple conceptual framework. The framework comprises four perspectives: the requirements perspective, the technology perspective, the application perspective, and the business perspective. Our literature review shows that mobile systems development is overlooked in the current debate. From the review, we extend the traditional view on systems development to encompass mobile systems and, based on the identified perspectives, we propose core characteristics for mobile systems. We also extend the traditional focus found in systems development on processes in a development project to encompass the whole of the development company as well as interorganizational linkage between development companies. Finally, we point at research directions emerging from the review that are relevant to the field of mobile systems development.",1989,http://ieeexplore.ieee.org/stamp/stamp.jsp?arnumber=198939,Jens Henrik Hosbond and Peter Axel Nielsen,"Book Series IFIP International Federation for Information Processing, Volume 185/2005, Book Designing Ubiquitous Information Environments: Socio-Technical Issues and Challenges, Pages 215-232, SpringerLink Date Thursday, February 09, 2006",1
16,"Quality, productivity and economic benefits of software reuse: a review of industrial studies","<p>Systematic software reuse is proposed to increase productivity and software quality and lead to economic benefits. Reports of successful software reuse programs in industry have been published. However, there has been little effort to organize the evidence systematically and appraise it. This review aims to assess the effects of software reuse in industrial contexts. Journals and major conferences between 1994 and 2005 were searched to find observational studies and experiments conducted in industry, returning eleven papers of observational type. Systematic software reuse is significantly related to lower problem (defect, fault or error) density in five studies and to decreased effort spent on correcting problems in three studies. The review found evidence for significant gains in apparent productivity in three studies. Other significant benefits of software reuse were reported in single studies or the results were inconsistent. Evidence from industry is sparse and combining results was done by vote-counting. Researchers should pay more attention to using comparable metrics, performing longitudinal studies, and explaining the results and impact on industry. For industry, evaluating reuse of COTS or OSS components, integrating reuse activities in software processes, better data collection and evaluating return on investment are major challenges.</p>",2007,http://dl.acm.org/citation.cfm?id=1290919&CFID=932217338&CFTOKEN=19657119,"Parastoo Mohagheghi, Reidar Conradi","Empirical Software Engineering,   Volume 12 Issue 5, October 2007, Empirical Software Engineering,   Volume 12 Issue 5, October 2007, Publisher: Kluwer Academic Publishers",1
17,Reflections on 10 Years of Software Process Simulation Modeling,"Software process simulation modeling (SPSM) has become an increasingly active research area since its introduction in the late 1980s. Particularly during the last ten years the related research community and the number of publications have been growing. The objective of this research is to provide insights about the evolution of SPSM research during the last 10 years. A systematic literature review was proposed with two subsequent stages to achieve this goal. This paper presents the preliminary results of the first stage of the review that is exclusively focusing on a core set of publication sources. More than 200 relevant publications were analyzed in order to find answers to the research questions, including the purposes and scopes of SPSM, application domains, and predominant research issues. From the analysis the following conclusions could be drawn: (1) Categories for classifying software process simulation models as suggested by the authors of a landmark publication in 1999 should be adjusted and refined to better capture the diversity of published models. (2) Research improving the efficiency of SPSM is gaining importance. (3) Hybrid process simulation models have attracted interest as a possibility to more realistically capture complex real-world software processes. ",2014,http://ieeexplore.ieee.org/stamp/stamp.jsp?arnumber=6984090,"He Zhang, Barbara Kitchenham and Dietmar Pfahl","Book Series Lecture Notes in Computer Science, Volume 5007/2008, Book Making Globally Distributed Software Development a Success Story, Pages 345-356, SpringerLink Date Tuesday, May 06, 2008",1
18,Software process improvement in small and medium software enterprises: a systematic review,"Small and medium enterprises are a very important cog in the gears of the world economy. The software industry in most countries is composed of an industrial scheme that is made up mainly of small and medium software enterprises--SMEs. To strengthen these types of organizations, efficient Software Engineering practices are needed--practices which have been adapted to their size and type of business. Over the last two decades, the Software Engineering community has expressed special interest in software process improvement (SPI) in an effort to increase software product quality, as well as the productivity of software development. However, there is a widespread tendency to make a point of stressing that the success of SPI is only possible for large companies. In this article, a systematic review of published case studies on the SPI efforts carried out in SMEs is presented. Its objective is to analyse the existing approaches towards SPI which focus on SMEs and which report a case study carried out in industry. A further objective is that of discussing the significant issues related to this area of knowledge, and to provide an up-to-date state of the art, from which innovative research activities can be thought of and planned.",2011,http://ieeexplore.ieee.org/stamp/stamp.jsp?arnumber=6083172,"Francisco J. Pino, F?lix Garc?a, Mario Piattini","Software Quality Control,   Volume 16 Issue 2, June 2008, Publisher: Kluwer Academic Publishers, pp 237 - 261",1
19,Software project economics: a roadmap,"The objective of this paper is to consider research progress in the field of software project economics with a view to identifying important challenges and promising research directions. I argue that this is an important sub-discipline since this will underpin any cost-benefit analysis used to justify the resourcing, or otherwise, of a software project. To accomplish this I conducted a bibliometric analysis of peer reviewed research articles to identify major areas of activity. My results indicate that the primary goal of more accurate cost prediction systems remains largely unachieved. However, there are a number of new and promising avenues of research including: how we can combine results from primary studies, integration of multiple predictions and applying greater emphasis upon the human aspects of prediction tasks. I conclude that the field is likely to remain very challenging due to the people-centric nature of software engineering, since it is in essence a design task. Nevertheless the need for good economic models will grow rather than diminish as software becomes increasingly ubiquitous.",2007,http://ieeexplore.ieee.org/stamp/stamp.jsp?arnumber=4221628,Martin Shepperd,"FOSE '07: 2007 Future of Software Engineering , May 2007",1
